{
  "schema": "singular.orchestration.audit-verdict.v1",
  "taskId": "TASK-0109",
  "runId": "RUN-20260813T221358Z-8581",
  "branch": "agent/session/TASK-0109-per-try-worker-log",
  "verdict": "accepted",
  "evidenceReviewed": [
    "/Users/alejandro/Desktop/999. PROJECTS/pmgo-orchestration-engine/.singular-state/runs/RUN-20260813T221358Z-8581/evidence-manifest.json",
    "/Users/alejandro/Desktop/999. PROJECTS/pmgo-orchestration-engine/.singular-state/runs/RUN-20260813T221358Z-8581/audit-verification.json",
    "docs/orchestration/tasks/TASK-0109.md acceptance criteria",
    "schemas/orchestration/audit-verdict.v1.schema.json",
    "Committed diff 0a5ac687c4977b027401dd20b5d4decc16153b7e..b874a87466e118eef167190a66e048d944ab7544",
    "Recovery-seed comparison ede05b0ef65e0258aa95fdd410ace8a985d90b5a..b874a87466e118eef167190a66e048d944ab7544",
    "Source inspection of all six owned files",
    "Manifest RED, GREEN, regression-gate, scope-check, secret-scan, file-hash, and diff-hash records",
    "packet.json manifest declaration: 4075 bytes, sha256 f1310d36a84a51f3d304d3e2afb9b79c2f28ece2b6261e8650dac03788bc4caf"
  ],
  "verificationResults": [
    {
      "status": "not-rerun-evidence-verified",
      "command": "/opt/homebrew/bin/bash -c bash tests/test-per-try-artifacts.sh && bash tests/test-executable-resolution.sh && bash tests/test-reconcile-low-disk.sh && bash tests/test-continuity-core.sh && bash tests/test-engine-clean.sh",
      "exitCode": 0,
      "evidenceRefs": [
        "audit-verification.json",
        "evidence-manifest.json#commands[audit-verification-gate]",
        "gate-check.log#sha256=d3a7ec08539ef0b0df46377456d8606259c5e90b955629c9a38e72c7af58d49f"
      ],
      "rationale": "The authoritative host report binds the evidence to exact head b874a87466e118eef167190a66e048d944ab7544, records rawExitCode 0, reports no failure or infrastructure signals, and verifies unchanged source integrity. The required host classification is preserved exactly."
    }
  ],
  "commandsRun": [
    "git status --short --branch; git branch --show-current; git rev-parse HEAD; git log -5 --oneline --decorate",
    "sed -n '1,260p' schemas/orchestration/audit-verdict.v1.schema.json",
    "git diff --name-status 0a5ac687..HEAD; git diff --stat 0a5ac687..HEAD; git show --format=fuller --stat HEAD",
    "sed -n '1,320p' evidence-manifest.json; sed -n '1,320p' audit-verification.json",
    "evidence-show.sh evidence-manifest.json packet.json 12000 (raw retrieval unavailable because the read-only sandbox denied the helper's /tmp lock file)",
    "rg -n --hidden 'TASK-0109|per-try|per try' .",
    "sed -n '1,260p' docs/orchestration/tasks/TASK-0109.md",
    "nl -ba tests/test-per-try-artifacts.sh; nl -ba tests/test-executable-resolution.sh; nl -ba tests/test-reconcile-low-disk.sh",
    "nl -ba engine/l1-drive.sh; git diff --unified=30 0a5ac687..HEAD -- engine/l1-drive.sh engine/lib.sh engine/reconcile.sh",
    "git show-ref refs/singular/operator-candidates/TASK-0109/RUN-20260813T213939Z-24911-attempt-2; git diff ede05b0ef65e0258aa95fdd410ace8a985d90b5a..HEAD",
    "git merge-base HEAD agent/integration; git rev-parse agent/integration; git rev-list --left-right --count agent/integration...HEAD",
    "shasum -a 256 engine/l1-drive.sh engine/lib.sh engine/reconcile.sh tests/test-executable-resolution.sh tests/test-per-try-artifacts.sh tests/test-reconcile-low-disk.sh",
    "git diff --no-ext-diff --binary 0a5ac687c4977b027401dd20b5d4decc16153b7e..b874a87466e118eef167190a66e048d944ab7544 | shasum -a 256"
  ],
  "findings": [],
  "requiredFixes": [],
  "rationale": "The committed head is clean, exactly one commit ahead of and directly based on agent/integration. Its six changed paths exactly match the owned scope, and all file hashes plus the committed-diff hash match the compact manifest. Five preserved owned files are byte-identical to recovery seed ede05b0e; only tests/test-per-try-artifacts.sh contains the required amended hermeticity proof. The manifest records a focused RED failure for the missing same-process second archive execution, followed by GREEN and the complete successful regression gate. Source inspection maps the acceptance criteria to assertions for immutable per-try logs, per-try failure classification, live rc-86 fallback, attempt-scoped archive sidecars, observational status with full lstat comparison, ten detached low-disk cycles with bounded wait and drain, and exactly two archive-helper invocations against distinct roots with literal caller checkout/state/event inventories checked after each invocation and final drain. No scope expansion, branch drift, skipped gate, schema/status/provenance inconsistency, singular-foundation violation, or undocumented product risk was found."
}
