{
  "schema": "singular.orchestration.audit-verdict.v1",
  "taskId": "TASK-0108",
  "runId": "RUN-20260813T182550Z-RECOVERY-TASK-0108-12256",
  "branch": "agent/eval/TASK-0108-reliability-contract",
  "verdict": "accepted",
  "evidenceReviewed": [
    "/Users/alejandro/Desktop/999. PROJECTS/pmgo-orchestration-engine/.singular-state/runs/RUN-20260813T182550Z-RECOVERY-TASK-0108-12256/evidence-manifest.json",
    "/Users/alejandro/Desktop/999. PROJECTS/pmgo-orchestration-engine/.singular-state/runs/RUN-20260813T182550Z-RECOVERY-TASK-0108-12256/packet.json",
    "/Users/alejandro/Desktop/999. PROJECTS/pmgo-orchestration-engine/.singular-state/runs/RUN-20260813T182550Z-RECOVERY-TASK-0108-12256/accept-existing-packet-scope.log",
    "/Users/alejandro/Desktop/999. PROJECTS/pmgo-orchestration-engine/.singular-state/runs/RUN-20260813T182550Z-RECOVERY-TASK-0108-12256/accept-existing-packet-secret-scan.log",
    "/Users/alejandro/Desktop/999. PROJECTS/pmgo-orchestration-engine/.singular-state/runs/RUN-20260813T182550Z-RECOVERY-TASK-0108-12256/accept-existing-packet-command-1.log",
    "/Users/alejandro/Desktop/999. PROJECTS/pmgo-orchestration-engine/.singular-state/runs/RUN-20260813T182550Z-RECOVERY-TASK-0108-12256/accept-existing-packet-command-2.log",
    ".singular-evidence/red.log",
    ".singular-evidence/green.log",
    ".singular-evidence/regression.log",
    "docs/orchestration/areas/reliability-contract.md",
    "runs/RUN-20260813T170836Z-93780/gate-report.json",
    "runs/RUN-20260813T170836Z-93780/audit.json",
    "runs/RUN-20260813T170836Z-93780/audit-verification.json",
    "runs/RUN-20260813T170836Z-93780/evidence-manifest.json",
    "runs/RUN-20260813T182550Z-RECOVERY-TASK-0108-12256/recovery-provenance.json"
  ],
  "commandsRun": [
    "scope-check.sh docs/orchestration/areas/reliability-contract.md",
    "secret-scan.sh --range 99bf1df5f5aaf821beff317a2a2c99f298b2b62c..HEAD",
    "bash -c 'set -e; file=docs/orchestration/areas/reliability-contract.md; test -f \"$file\" || { echo \"FAIL: missing $file\"; exit 1; }; for pattern in \"## Safety invariants\" \"checkpoint-never-acceptance\" \"advocate/skeptic separation\" \"exact job identity\" \"evidence binding unchanged\" \"checkpoint scope fail-closed\" \"evidence-remedies-never-implement\" \"no auto-redispatch of known ambiguous external effects\" \"recovery-never-kills-live-work\" \"## Audited baseline failure modes\" \"engine/l1-drive.sh\" \"worker-codex.log\" \"last-message.json\" \"revalidate-evidence\" \"13 emitter sites\" \"SECONDS + budget\" \"l1_on_exit\" \"singular_l1_reclaim_stale\" \"audit-codex.log\" \"auditor-codex.log\" \"## Explicit deferrals\" \"checkpoint grades beyond snapshot\" \"effect ledger\" \"writable run-control\" \"cross-run resume\" \"budget heuristics\"; do rg -F --quiet \"$pattern\" \"$file\" || { echo \"FAIL: missing required text: $pattern\"; exit 1; }; done; echo \"PASS: reliability contract contains all required sections and anchors\"' > .singular-evidence/green.log 2>&1",
    "set -o pipefail; { bash engine/dag.sh validate-dag && bash tests/test-engine-clean.sh; } 2>&1 | tee .singular-evidence/regression.log"
  ],
  "findings": [
    "deterministic acceptance for an existing stranded packet",
    "packet branch head matched packet headSha",
    "scope check, secret scan, and current successful packet commands passed in a disposable exact-head worktree",
    "the original packet workspace remained immutable and disposable source integrity was verified"
  ],
  "requiredFixes": [],
  "rationale": "Existing worker output was accepted deterministically because the packet is valid, branch head matches, scope is clean, evidence is present, and successful packet commands pass when rerun.",
  "verificationResults": [
    {
      "status": "passed",
      "command": "deterministic existing-packet scope, secret, and command verification",
      "exitCode": 0,
      "evidenceRefs": [
        "/Users/alejandro/Desktop/999. PROJECTS/pmgo-orchestration-engine/.singular-state/runs/RUN-20260813T182550Z-RECOVERY-TASK-0108-12256/evidence-manifest.json",
        "/Users/alejandro/Desktop/999. PROJECTS/pmgo-orchestration-engine/.singular-state/runs/RUN-20260813T182550Z-RECOVERY-TASK-0108-12256/accept-existing-packet-scope.log",
        "/Users/alejandro/Desktop/999. PROJECTS/pmgo-orchestration-engine/.singular-state/runs/RUN-20260813T182550Z-RECOVERY-TASK-0108-12256/accept-existing-packet-secret-scan.log",
        "/Users/alejandro/Desktop/999. PROJECTS/pmgo-orchestration-engine/.singular-state/runs/RUN-20260813T182550Z-RECOVERY-TASK-0108-12256/accept-existing-packet-command-1.log",
        "/Users/alejandro/Desktop/999. PROJECTS/pmgo-orchestration-engine/.singular-state/runs/RUN-20260813T182550Z-RECOVERY-TASK-0108-12256/accept-existing-packet-command-2.log"
      ],
      "rationale": "All deterministic existing-packet checks passed in a disposable worktree at the exact packet head without source mutation."
    }
  ]
}
