{
  "schema": "singular.orchestration.audit-verdict.v1",
  "taskId": "TASK-0111",
  "runId": "RUN-20260814T155312Z-23686",
  "branch": "agent/foundation/TASK-0111-integrity-reclass",
  "verdict": "accepted",
  "evidenceReviewed": [
    "evidence-manifest.json: head eec44d4ff2e4c0460a17952f6c8a485217cbf7ce, bound diff and owned-file hashes, scope/secret/gate checks, RED/GREEN/regression command evidence, and recovery provenance artifact declarations",
    "audit-verification.json: evidence-only host verification at the manifest head, rawExitCode 0, sourceIntegrity.status verified, no changed paths or failure signals",
    "docs/orchestration/tasks/TASK-0111.md acceptance criteria and recovery constraints",
    "Committed diff eec44d4ff2e4c0460a17952f6c8a485217cbf7ce against parent d716606aff5f54798e0b52be80bccc049ad10d78",
    "engine/l1-drive.sh, engine/lib.sh, and tests/test-decider-fastpath.sh at the audited head",
    "schemas/orchestration/audit-verdict.v1.schema.json and schemas/decider-verdict.v0.schema.json",
    "Git branch, ancestry, worktree cleanliness, blob identity, file SHA-256, and diff SHA-256 checks",
    "Recovery seed-to-current test blob comparison"
  ],
  "verificationResults": [
    {
      "status": "not-rerun-evidence-verified",
      "command": "/opt/homebrew/bin/bash -c bash tests/test-decider-fastpath.sh && bash tests/test-engine-clean.sh",
      "exitCode": 0,
      "evidenceRefs": [
        "audit-verification.json",
        "gate-check.log@sha256:044fdd3a9cb71c1e3b32b28a4a2dd18ef2e535f4f204de27e09c1eafdb5b896b",
        "gate-report.json@sha256:39f1b31dbd6cc1eab590f73f803105532c686821725326c363bc61ee4939e1d8",
        "evidence-manifest.json"
      ],
      "rationale": "The authoritative host report classified verification as not-rerun-evidence-verified: the successful worker gate evidence was hash-bound to audited head eec44d4ff2e4c0460a17952f6c8a485217cbf7ce, source integrity was verified with no changed paths, and no product or infrastructure failure signals were recorded."
    }
  ],
  "commandsRun": [
    "jq . evidence-manifest.json",
    "jq . audit-verification.json",
    "git status --short --branch",
    "git rev-parse HEAD",
    "git diff --stat HEAD^ HEAD",
    "git diff --name-status HEAD^ HEAD",
    "evidence-show.sh evidence-manifest.json packet.json 5000",
    "rg -n --hidden --glob '!node_modules' --glob '!.git' 'TASK-0111|integrity.reclass|integrity violation|integrity-violation' .",
    "sed -n '1,260p' schemas/orchestration/audit-verdict.v1.schema.json",
    "git diff --no-ext-diff HEAD^ HEAD -- engine/l1-drive.sh engine/lib.sh tests/test-decider-fastpath.sh",
    "sed -n '1,150p' docs/orchestration/tasks/TASK-0111.md",
    "git rev-parse agent/integration HEAD^",
    "git merge-base HEAD agent/integration",
    "git rev-list --left-right --count agent/integration...HEAD",
    "git hash-object engine/l1-drive.sh engine/lib.sh tests/test-decider-fastpath.sh",
    "shasum -a 256 engine/l1-drive.sh engine/lib.sh tests/test-decider-fastpath.sh",
    "git diff HEAD^ HEAD | shasum -a 256",
    "git diff --name-only agent/integration...HEAD",
    "git diff --no-ext-diff e66abcd20b2887b6a7ecc3b6e34d1bb5b9315b70 5ead13c2e4a03d382e95024da568e5bad0617b86",
    "git diff --check agent/integration...HEAD",
    "jq '{failureClass:.properties.failureClass, action:.properties.action}' schemas/decider-verdict.v0.schema.json"
  ],
  "findings": [],
  "requiredFixes": [],
  "rationale": "The audited head is exactly one commit ahead of agent/integration with that target as its parent, so there is no branch drift. The diff modifies only the three owned files; manifest file hashes and diff hash match the committed checkout, the worktree is clean, scope and secret checks passed, and no schema changed. Strict test-first evidence records the required behavioral RED before GREEN, followed by the combined regression gate. Both production blobs exactly match the mandated recovery seed blob IDs, while the test differs from its seed only by the permitted hermetic environment cleanup and stronger disabled-fastpath, artifact-integrity, action, and policy-provenance assertions. The implementation assigns integrity-violation at the source-integrity emitter, preserves audit-verification.json context, routes the class unconditionally to escalate-parked before disable/repeat handling, leaves worker-infra and audit-infra routing unchanged, and requires no schema widening because failureClass is free-form and escalate-parked is already allowed. The host-bound evidence confirms all focused and engine-clean assertions passed, including unchanged retryCount and absence of auditor/decider invocation. The bounded packet-viewer attempt was prevented by its lock-file write under the read-only audit sandbox; this is an audit-environment limitation rather than a product finding, and the compact hash-bound evidence plus exact-head inspection was sufficient to establish compliance."
}
