{
  "schema": "singular.orchestration.audit-verdict.v1",
  "taskId": "TASK-0110",
  "runId": "RUN-20260814T041625Z-15168",
  "branch": "agent/session/TASK-0110-try-hygiene",
  "verdict": "accepted",
  "evidenceReviewed": [
    "evidence-manifest.json: head 7ca9c5c14a5816516c4d9769241e8c87f29122ee; gate, scope, and secret checks passed; changed-file and command evidence reviewed",
    "audit-verification.json: outcome not-rerun-evidence-verified, rawExitCode 0, sourceIntegrity verified with no changed paths",
    "docs/orchestration/tasks/TASK-0110.md acceptance criteria and strict_test_first policy",
    "Committed diff 9487683176cd5a93abddae9ffdce9b84532e0ac2...7ca9c5c14a5816516c4d9769241e8c87f29122ee",
    "engine/l1-drive.sh production changes",
    "tests/test-per-try-artifacts.sh stale-output, rc86 fallback, archive isolation, nonce, decoy, sibling-writer, and final-drain assertions",
    "tests/test-session-affinity.sh worker and auditor infra-retry session assertions",
    "Operator overlay acceptance-finalization path that atomically stamps the accepted packet, refreshes and verifies its manifest binding, and only then publishes the inbox copy",
    "schemas/orchestration/audit-verdict.v1.schema.json"
  ],
  "verificationResults": [
    {
      "status": "not-rerun-evidence-verified",
      "command": "/opt/homebrew/bin/bash -c bash tests/test-per-try-artifacts.sh && bash tests/test-session-affinity.sh && bash tests/test-engine-clean.sh",
      "exitCode": 0,
      "evidenceRefs": [
        "/Users/alejandro/Desktop/999. PROJECTS/pmgo-orchestration-engine/.singular-state/runs/RUN-20260814T041625Z-15168/audit-verification.json",
        "/Users/alejandro/Desktop/999. PROJECTS/pmgo-orchestration-engine/.singular-state/runs/RUN-20260814T041625Z-15168/evidence-manifest.json",
        "gate-check.log#sha256=f08c44917ce29cc32e11524cd6f9b766a12680a0b3f65cf7c10f79a630753903"
      ],
      "rationale": "The authoritative host report classifies the disposable exact-HEAD verification as not-rerun-evidence-verified with raw exit code 0, no failure or infrastructure signals, and verified source integrity. The bound gate log records all focused tests and engine-clean passing."
    }
  ],
  "commandsRun": [
    "git status --short --branch; git rev-parse HEAD; git branch --show-current",
    "jq . evidence-manifest.json; jq . audit-verification.json; inspect audit-verdict schema",
    "git log; git merge-base HEAD agent/integration; git rev-list --left-right --count agent/integration...HEAD; git diff --name-status/--stat/--check agent/integration...HEAD",
    "shasum -a 256 engine/l1-drive.sh tests/test-per-try-artifacts.sh tests/test-session-affinity.sh",
    "git diff --unified agent/integration...HEAD for all three owned files",
    "rg and numbered source inspection of cleanup, retry-affinity, archive-isolation, nonce, decoy, sibling-writer, and fallback assertions",
    "bash -n engine/l1-drive.sh tests/test-per-try-artifacts.sh tests/test-session-affinity.sh",
    "git diff agent/integration...HEAD | shasum -a 256",
    "evidence-show.sh evidence-manifest.json packet.json 8192 (infrastructure-only failure: sandbox denied creation of the helper's /tmp lock file)",
    "shasum -a 256 run packet.json and inspect the operator overlay acceptance-finalization binding path"
  ],
  "findings": [],
  "requiredFixes": [],
  "rationale": "The committed branch is clean, exactly one commit ahead of and directly based on the current agent/integration target. Its only changed paths are the three owned files; their hashes and the committed-diff hash match the compact manifest. Production scope is exactly the mandated two removals of stale worker output: before every worker try and before the same-try rc86 fresh fallback; auditor cleanup is unchanged. The strict test-first record contains the expected focused RED for stale try-0 output masking try-1 failure, followed by focused GREEN and a complete passing regression. Source inspection confirms mutation-sensitive coverage for stale-output classification, absent stale files, live rc86 refusal/fallback, unchanged attempt/try accounting, resumable try 0 versus fresh try 1 for both worker and auditor, causal sibling-writer overlap, independent decoy canaries, fixture-local nonce/event isolation, protected-file fingerprints, two same-process archive calls, and bounded final drain. The named operator overlay fail-closes acceptance unless the newly accepted root packet is manifest-bound before control-state acceptance and inbox publication. The bounded raw packet helper's lock-file denial was an audit-environment limitation and is not a product finding; compact manifest extraction, the matching packet SHA, and host source-integrity evidence remained available. No scope expansion, branch drift, skipped required gate, lifecycle/status/provenance inconsistency, missing acceptance test, singular-foundation violation, or undocumented product risk was found."
}
